{
  "meta": {
    "map_id": "sample_auto_001",
    "version": "0.1.0",
    "condition_type": "auto"
  },
  "nodes": [
    {
      "id": "N1",
      "label": {
        "en": "Node 1",
        "ja": "地点1"
      },
      "tags": [
        "corridor",
        "zone-1"
      ],
      "ocr": [],
      "descriptions": {
        "front": {
          "level_1": {
            "en": "Node 1 front quick cue.",
            "ja": "ノード1のfront方向の短い案内。"
          },
          "level_3": {
            "en": "Node 1 facing front. Corridor and nearby points are described.",
            "ja": "ノード1でfront方向を向いています。通路と周辺の要素を説明します。"
          },
          "level_5": {
            "en": "Detailed tourism description at node 1 toward front, including exhibits and landmarks.",
            "ja": "ノード1のfront方向の詳細説明です。展示物や目印を含みます。"
          }
        },
        "front_right": {
          "level_1": {
            "en": "Node 1 front_right quick cue.",
            "ja": "ノード1のfront_right方向の短い案内。"
          },
          "level_3": {
            "en": "Node 1 facing front_right. Corridor and nearby points are described.",
            "ja": "ノード1でfront_right方向を向いています。通路と周辺の要素を説明します。"
          },
          "level_5": {
            "en": "Detailed tourism description at node 1 toward front_right, including exhibits and landmarks.",
            "ja": "ノード1のfront_right方向の詳細説明です。展示物や目印を含みます。"
          }
        },
        "right": {
          "level_1": {
            "en": "Node 1 right quick cue.",
            "ja": "ノード1のright方向の短い案内。"
          },
          "level_3": {
            "en": "Node 1 facing right. Corridor and nearby points are described.",
            "ja": "ノード1でright方向を向いています。通路と周辺の要素を説明します。"
          },
          "level_5": {
            "en": "Detailed tourism description at node 1 toward right, including exhibits and landmarks.",
            "ja": "ノード1のright方向の詳細説明です。展示物や目印を含みます。"
          }
        },
        "back_right": {
          "level_1": {
            "en": "Node 1 back_right quick cue.",
            "ja": "ノード1のback_right方向の短い案内。"
          },
          "level_3": {
            "en": "Node 1 facing back_right. Corridor and nearby points are described.",
            "ja": "ノード1でback_right方向を向いています。通路と周辺の要素を説明します。"
          },
          "level_5": {
            "en": "Detailed tourism description at node 1 toward back_right, including exhibits and landmarks.",
            "ja": "ノード1のback_right方向の詳細説明です。展示物や目印を含みます。"
          }
        },
        "back": {
          "level_1": {
            "en": "Node 1 back quick cue.",
            "ja": "ノード1のback方向の短い案内。"
          },
          "level_3": {
            "en": "Node 1 facing back. Corridor and nearby points are described.",
            "ja": "ノード1でback方向を向いています。通路と周辺の要素を説明します。"
          },
          "level_5": {
            "en": "Detailed tourism description at node 1 toward back, including exhibits and landmarks.",
            "ja": "ノード1のback方向の詳細説明です。展示物や目印を含みます。"
          }
        },
        "back_left": {
          "level_1": {
            "en": "Node 1 back_left quick cue.",
            "ja": "ノード1のback_left方向の短い案内。"
          },
          "level_3": {
            "en": "Node 1 facing back_left. Corridor and nearby points are described.",
            "ja": "ノード1でback_left方向を向いています。通路と周辺の要素を説明します。"
          },
          "level_5": {
            "en": "Detailed tourism description at node 1 toward back_left, including exhibits and landmarks.",
            "ja": "ノード1のback_left方向の詳細説明です。展示物や目印を含みます。"
          }
        },
        "left": {
          "level_1": {
            "en": "Node 1 left quick cue.",
            "ja": "ノード1のleft方向の短い案内。"
          },
          "level_3": {
            "en": "Node 1 facing left. Corridor and nearby points are described.",
            "ja": "ノード1でleft方向を向いています。通路と周辺の要素を説明します。"
          },
          "level_5": {
            "en": "Detailed tourism description at node 1 toward left, including exhibits and landmarks.",
            "ja": "ノード1のleft方向の詳細説明です。展示物や目印を含みます。"
          }
        },
        "front_left": {
          "level_1": {
            "en": "Node 1 front_left quick cue.",
            "ja": "ノード1のfront_left方向の短い案内。"
          },
          "level_3": {
            "en": "Node 1 facing front_left. Corridor and nearby points are described.",
            "ja": "ノード1でfront_left方向を向いています。通路と周辺の要素を説明します。"
          },
          "level_5": {
            "en": "Detailed tourism description at node 1 toward front_left, including exhibits and landmarks.",
            "ja": "ノード1のfront_left方向の詳細説明です。展示物や目印を含みます。"
          }
        }
      }
    },
    {
      "id": "N2",
      "label": {
        "en": "Node 2",
        "ja": "地点2"
      },
      "tags": [
        "corridor",
        "zone-1"
      ],
      "ocr": [],
      "descriptions": {
        "front": {
          "level_1": {
            "en": "Node 2 front quick cue.",
            "ja": "ノード2のfront方向の短い案内。"
          },
          "level_3": {
            "en": "Node 2 facing front. Corridor and nearby points are described.",
            "ja": "ノード2でfront方向を向いています。通路と周辺の要素を説明します。"
          },
          "level_5": {
            "en": "Detailed tourism description at node 2 toward front, including exhibits and landmarks.",
            "ja": "ノード2のfront方向の詳細説明です。展示物や目印を含みます。"
          }
        },
        "front_right": {
          "level_1": {
            "en": "Node 2 front_right quick cue.",
            "ja": "ノード2のfront_right方向の短い案内。"
          },
          "level_3": {
            "en": "Node 2 facing front_right. Corridor and nearby points are described.",
            "ja": "ノード2でfront_right方向を向いています。通路と周辺の要素を説明します。"
          },
          "level_5": {
            "en": "Detailed tourism description at node 2 toward front_right, including exhibits and landmarks.",
            "ja": "ノード2のfront_right方向の詳細説明です。展示物や目印を含みます。"
          }
        },
        "right": {
          "level_1": {
            "en": "Node 2 right quick cue.",
            "ja": "ノード2のright方向の短い案内。"
          },
          "level_3": {
            "en": "Node 2 facing right. Corridor and nearby points are described.",
            "ja": "ノード2でright方向を向いています。通路と周辺の要素を説明します。"
          },
          "level_5": {
            "en": "Detailed tourism description at node 2 toward right, including exhibits and landmarks.",
            "ja": "ノード2のright方向の詳細説明です。展示物や目印を含みます。"
          }
        },
        "back_right": {
          "level_1": {
            "en": "Node 2 back_right quick cue.",
            "ja": "ノード2のback_right方向の短い案内。"
          },
          "level_3": {
            "en": "Node 2 facing back_right. Corridor and nearby points are described.",
            "ja": "ノード2でback_right方向を向いています。通路と周辺の要素を説明します。"
          },
          "level_5": {
            "en": "Detailed tourism description at node 2 toward back_right, including exhibits and landmarks.",
            "ja": "ノード2のback_right方向の詳細説明です。展示物や目印を含みます。"
          }
        },
        "back": {
          "level_1": {
            "en": "Node 2 back quick cue.",
            "ja": "ノード2のback方向の短い案内。"
          },
          "level_3": {
            "en": "Node 2 facing back. Corridor and nearby points are described.",
            "ja": "ノード2でback方向を向いています。通路と周辺の要素を説明します。"
          },
          "level_5": {
            "en": "Detailed tourism description at node 2 toward back, including exhibits and landmarks.",
            "ja": "ノード2のback方向の詳細説明です。展示物や目印を含みます。"
          }
        },
        "back_left": {
          "level_1": {
            "en": "Node 2 back_left quick cue.",
            "ja": "ノード2のback_left方向の短い案内。"
          },
          "level_3": {
            "en": "Node 2 facing back_left. Corridor and nearby points are described.",
            "ja": "ノード2でback_left方向を向いています。通路と周辺の要素を説明します。"
          },
          "level_5": {
            "en": "Detailed tourism description at node 2 toward back_left, including exhibits and landmarks.",
            "ja": "ノード2のback_left方向の詳細説明です。展示物や目印を含みます。"
          }
        },
        "left": {
          "level_1": {
            "en": "Node 2 left quick cue.",
            "ja": "ノード2のleft方向の短い案内。"
          },
          "level_3": {
            "en": "Node 2 facing left. Corridor and nearby points are described.",
            "ja": "ノード2でleft方向を向いています。通路と周辺の要素を説明します。"
          },
          "level_5": {
            "en": "Detailed tourism description at node 2 toward left, including exhibits and landmarks.",
            "ja": "ノード2のleft方向の詳細説明です。展示物や目印を含みます。"
          }
        },
        "front_left": {
          "level_1": {
            "en": "Node 2 front_left quick cue.",
            "ja": "ノード2のfront_left方向の短い案内。"
          },
          "level_3": {
            "en": "Node 2 facing front_left. Corridor and nearby points are described.",
            "ja": "ノード2でfront_left方向を向いています。通路と周辺の要素を説明します。"
          },
          "level_5": {
            "en": "Detailed tourism description at node 2 toward front_left, including exhibits and landmarks.",
            "ja": "ノード2のfront_left方向の詳細説明です。展示物や目印を含みます。"
          }
        }
      }
    },
    {
      "id": "N3",
      "label": {
        "en": "Node 3",
        "ja": "地点3"
      },
      "tags": [
        "corridor",
        "zone-1"
      ],
      "ocr": [],
      "descriptions": {
        "front": {
          "level_1": {
            "en": "Node 3 front quick cue.",
            "ja": "ノード3のfront方向の短い案内。"
          },
          "level_3": {
            "en": "Node 3 facing front. Corridor and nearby points are described.",
            "ja": "ノード3でfront方向を向いています。通路と周辺の要素を説明します。"
          },
          "level_5": {
            "en": "Detailed tourism description at node 3 toward front, including exhibits and landmarks.",
            "ja": "ノード3のfront方向の詳細説明です。展示物や目印を含みます。"
          }
        },
        "front_right": {
          "level_1": {
            "en": "Node 3 front_right quick cue.",